{
  "$schema": "https://json-schema.org/draft/2020-12/schema",
  "$id": "https://inspect_ia_agents.local/schemas/maf-orchestration.schema.json",
  "title": "inspect_ia_agents recette -- MAF multi-agent handoff team",
  "description": "What a multi-agent handoff orchestration DECLARES: its participants, the start agent, and the allowed handoff graph. Mirrors the microsoft/agent-framework HandoffBuilder model (participants + with_start_agent + per-source HandoffConfiguration set). The judged unit is the team: the sibling run.json records what actually happened, and the gap is what makes the orchestration correct or incorrect.",
  "type": "object",
  "additionalProperties": false,
  "required": ["kind", "agent_id", "name", "participants"],
  "properties": {
    "kind": { "const": "maf_orchestration" },
    "style": {
      "type": "string",
      "enum": ["handoff", "sequential", "concurrent", "group_chat", "magentic"],
      "default": "handoff",
      "description": "MAF orchestration style. handoff: a mesh routed by handoff_to (HandoffBuilder). sequential: an ordered chain, each participant once in order (SequentialBuilder). concurrent: fan-out/fan-in, each participant once on the same input (ConcurrentBuilder). group_chat: a manager-moderated round-table where participants take turns (GroupChatBuilder); the run order is the speaking sequence. magentic: a manager plans and selects the next speaker each round against a progress ledger with stall/round limits (MagenticBuilder); the run order is the selected-speaker sequence."
    },
    "agent_id": {
      "type": "string",
      "description": "Orchestration identifier; matches the sibling run.json and ground-truth.json.",
      "pattern": "^[a-z0-9][a-z0-9-]{1,63}$"
    },
    "name": { "type": "string", "minLength": 1 },
    "description": { "type": "string" },
    "source": {
      "type": "object",
      "additionalProperties": true,
      "description": "Provenance of the orchestration shape (e.g. microsoft-agent-framework HandoffBuilder)."
    },
    "start_agent": {
      "type": "string",
      "description": "The participant that receives the first input (HandoffBuilder.with_start_agent).",
      "minLength": 1
    },
    "termination": {
      "type": "object",
      "additionalProperties": false,
      "description": "Termination guard, mirroring HandoffBuilder.termination_condition.",
      "properties": {
        "max_hops": {
          "type": "integer",
          "minimum": 1,
          "description": "Upper bound on handoff hops before the orchestration must terminate."
        }
      }
    },
    "participants": {
      "type": "array",
      "minItems": 2,
      "description": "The handoff mesh participants. Each declares its identity, the targets it may hand off to, and the tools it may invoke.",
      "items": {
        "type": "object",
        "additionalProperties": false,
        "required": ["agent_id", "declared_identity"],
        "properties": {
          "agent_id": {
            "type": "string",
            "pattern": "^[a-z0-9][a-z0-9-]{1,63}$"
          },
          "declared_identity": {
            "type": "object",
            "additionalProperties": true,
            "required": ["provider", "model"],
            "properties": {
              "provider": { "type": "string", "minLength": 1 },
              "model": { "type": "string", "minLength": 1 }
            }
          },
          "handoffs": {
            "type": "array",
            "description": "Allowed handoff targets for this participant (the source's HandoffConfiguration set).",
            "items": {
              "type": "object",
              "additionalProperties": false,
              "required": ["target"],
              "properties": {
                "target": { "type": "string", "minLength": 1 },
                "description": { "type": "string" }
              }
            }
          },
          "tools": {
            "type": "array",
            "description": "Tools this participant may invoke (same shape as a MAF capability_scope invoke_tool entry).",
            "items": {
              "type": "object",
              "additionalProperties": false,
              "required": ["tool_kind", "target"],
              "properties": {
                "tool_kind": {
                  "type": "string",
                  "enum": ["mcp", "function", "web_search", "file_search", "code_interpreter"]
                },
                "target": { "type": "string", "minLength": 1 },
                "approval": { "type": "string", "enum": ["never", "always"], "default": "never" }
              }
            }
          }
        }
      }
    }
  }
}
